Disease,Symptom_1,Symptom_2,Symptom_3,Symptom_4,Description,Treatment
Aortic Aneurysm,abdominal pain,back pain,pulsating mass,no symptoms,Weakened bulging area in aorta,Monitoring lifestyle changes surgery if large
Mitral Valve Prolapse,chest pain,palpitations,fatigue,shortness of breath,Heart valve doesn't close properly,Monitoring medications surgery if severe
Cardiomyopathy,shortness of breath,fatigue,swelling,irregular heartbeat,Disease of heart muscle,Medications lifestyle changes device therapy transplant
Pericarditis,sharp chest pain,fever,difficulty breathing,cough,Inflammation of heart's protective sac,Anti-inflammatory medications rest pericardiocentesis
Endocarditis,fever,fatigue,heart murmur,joint pain,Infection of heart's inner lining,Antibiotics hospitalization valve replacement if severe
Raynaud's Phenomenon,color changes in fingers,numbness,tingling,pain,Reduced blood flow to fingers and toes,Lifestyle changes medications avoid triggers
Chronic Obstructive Pulmonary Disease,shortness of breath,chronic cough,wheezing,chest tightness,Progressive lung disease limiting airflow,Bronchodilators lifestyle changes oxygen therapy
Emphysema,shortness of breath,chronic cough,barrel chest,fatigue,Lung condition with damaged air sacs,Bronchodilators oxygen therapy pulmonary rehabilitation
Chronic Bronchitis,persistent cough,mucus production,shortness of breath,wheezing,Long-term inflammation of airways,Bronchodilators mucolytics lifestyle changes
Pulmonary Fibrosis,progressive shortness of breath,dry cough,fatigue,weight loss,Lung scarring reducing oxygen transfer,Anti-fibrotic medications oxygen therapy transplant
Sarcoidosis,shortness of breath,persistent cough,fatigue,skin lesions,Inflammatory disease affecting multiple organs,Corticosteroids immunosuppressants monitoring
Pleural Effusion,shortness of breath,chest pain,dry cough,reduced exercise tolerance,Fluid accumulation around lungs,Thoracentesis treat underlying cause medications
Pleurisy,sharp chest pain,shortness of breath,cough,fever,Inflammation of lung membrane,Anti-inflammatory medications treat underlying cause
Interstitial Lung Disease,progressive shortness of breath,dry cough,fatigue,clubbing of fingers,Group of lung disorders causing scarring,Corticosteroids oxygen therapy transplant if severe
Lung Cancer,persistent cough,chest pain,shortness of breath,weight loss,Malignant tumor in lungs,Surgery chemotherapy radiation therapy immunotherapy
Mesothelioma,chest pain,shortness of breath,persistent cough,weight loss,Cancer affecting lung lining often from asbestos,Surgery chemotherapy radiation therapy
Vocal Cord Paralysis,hoarse voice,breathy voice,difficulty swallowing,aspiration,Nerve damage affecting vocal cord movement,Voice therapy surgery injections
Laryngitis,hoarse voice,sore throat,dry cough,throat clearing,Inflammation of voice box,Voice rest hydration treat underlying cause
Pharyngitis,sore throat,difficulty swallowing,swollen glands,fever,Inflammation of throat,Antibiotics if bacterial pain relievers rest
Tonsillitis,sore throat,swollen tonsils,difficulty swallowing,fever,Inflammation of tonsils,Antibiotics pain relievers tonsillectomy if recurrent
Epiglottitis,severe sore throat,difficulty swallowing,drooling,high fever,Inflammation of epiglottis,Emergency antibiotics hospitalization airway management
Croup,barking cough,stridor,hoarse voice,fever,Viral infection causing airway swelling,Humidified air corticosteroids supportive care
Whooping Cough,severe coughing fits,whooping sound,vomiting after coughing,exhaustion,Bacterial infection causing severe cough,Antibiotics supportive care isolation
Pertussis,paroxysmal cough,whooping sound,post-cough vomiting,apnea in infants,Highly contagious bacterial respiratory infection,Antibiotics supportive care vaccination prevention
Diphtheria,sore throat,low fever,swollen neck glands,gray membrane,Bacterial infection affecting throat and airways,Antitoxin antibiotics supportive care vaccination
Epiglottitis,severe throat pain,difficulty swallowing,muffled voice,high fever,Life-threatening inflammation of epiglottis,Emergency airway management antibiotics hospitalization
Retropharyngeal Abscess,severe throat pain,difficulty swallowing,neck stiffness,high fever,Deep neck infection,Surgical drainage antibiotics hospitalization
Parapharyngeal Abscess,throat pain,trismus,neck swelling,fever,Deep neck space infection,Surgical drainage antibiotics hospitalization
Ludwig's Angina,floor of mouth swelling,difficulty swallowing,drooling,fever,Serious neck infection,Emergency antibiotics surgical drainage airway management
Quinsy,severe throat pain,difficulty swallowing,drooling,trismus,Severe throat infection with abscess,Surgical drainage antibiotics hospitalization
Peritonsillar Abscess,severe sore throat,difficulty opening mouth,muffled voice,ear pain,Abscess near tonsils,Drainage antibiotics pain management
Mastoiditis,ear pain,swelling behind ear,fever,hearing loss,Infection of bone behind ear,Antibiotics surgical drainage hospitalization
Labyrinthitis,severe dizziness,hearing loss,nausea,balance problems,Inner ear infection causing vertigo,Antibiotics vestibular suppressants rest
Meniere's Disease,episodes of vertigo,hearing loss,tinnitus,ear fullness,Inner ear disorder affecting balance and hearing,Diuretics dietary changes vestibular therapy
Acoustic Neuroma,gradual hearing loss,tinnitus,balance problems,facial numbness,Benign tumor on hearing nerve,Surgery radiation therapy monitoring
Otosclerosis,progressive hearing loss,tinnitus,dizziness,family history,Abnormal bone growth in middle ear,Hearing aids surgery fluoride supplements
Perforated Eardrum,ear pain,hearing loss,discharge,tinnitus,Hole in eardrum from infection or trauma,Antibiotics keep ear dry surgical repair if needed
Cholesteatoma,hearing loss,ear discharge,dizziness,ear pressure,Abnormal skin growth in middle ear,Surgical removal antibiotics hearing aids
Swimmer's Ear,ear pain,itching,discharge,hearing loss,Infection of outer ear canal,Antibiotic drops pain relievers keep ear dry
Cerumen Impaction,hearing loss,ear fullness,dizziness,ringing,Earwax blockage,Professional removal ear drops irrigation
Presbycusis,gradual hearing loss,difficulty understanding speech,tinnitus,social isolation,Age-related hearing loss,Hearing aids assistive devices communication strategies
Noise-Induced Hearing Loss,hearing loss,tinnitus,difficulty hearing high frequencies,ear pain,Damage from loud noise exposure,Hearing protection hearing aids avoid loud noises
Sudden Sensorineural Hearing Loss,sudden hearing loss,tinnitus,dizziness,ear fullness,Rapid hearing loss requiring immediate treatment,Corticosteroids hyperbaric oxygen audiologic rehabilitation
Conductive Hearing Loss,hearing loss,ear fullness,difficulty hearing soft sounds,normal bone conduction,Blockage preventing sound transmission,Treat underlying cause hearing aids surgery
Sensorineural Hearing Loss,hearing loss,difficulty understanding speech,tinnitus,recruitment,Damage to inner ear or hearing nerve,Hearing aids cochlear implants assistive devices
Mixed Hearing Loss,combination of conductive and sensorineural symptoms,variable presentation,Complex hearing loss with multiple causes,Combination of treatments hearing aids surgery
Central Auditory Processing Disorder,difficulty understanding speech,normal hearing,poor listening skills,academic problems,Brain's inability to process auditory information,Auditory training assistive devices environmental modifications
Hyperacusis,sound sensitivity,ear pain,discomfort with normal sounds,social withdrawal,Reduced tolerance to everyday sounds,Sound therapy counseling hearing protection
Misophonia,anger at specific sounds,anxiety,avoidance behaviors,fight or flight response,Strong emotional reaction to certain sounds,Cognitive behavioral therapy sound therapy coping strategies
Tinnitus,ringing in ears,buzzing,hissing,roaring,Perception of sound without external stimulus,Tinnitus retraining therapy hearing aids sound masking
Pulsatile Tinnitus,rhythmic tinnitus,heartbeat sounds,whooshing,objective tinnitus,Tinnitus synchronized with heartbeat,Treat underlying vascular cause sound therapy
Presbyopia,difficulty reading,eye strain,headaches,need for reading glasses,Age-related decline in near vision,Reading glasses bifocals progressive lenses surgery
Myopia,distant vision problems,squinting,eye strain,headaches,Nearsightedness difficulty seeing far objects,Corrective lenses contact lenses refractive surgery
Hyperopia,near vision problems,eye strain,headaches,difficulty focusing,Farsightedness difficulty seeing near objects,Corrective lenses contact lenses refractive surgery
Astigmatism,blurred vision,eye strain,headaches,distorted vision,Irregular corneal shape causing vision problems,Corrective lenses contact lenses refractive surgery
Amblyopia,poor vision in one eye,depth perception problems,eye turning,head tilting,Lazy eye with reduced vision development,Eye patching vision therapy corrective lenses
Strabismus,crossed eyes,double vision,poor depth perception,head tilting,Misalignment of eyes,Corrective lenses eye exercises surgery
Ptosis,drooping eyelid,reduced vision,eye fatigue,asymmetrical appearance,Drooping of upper eyelid,Surgery to lift eyelid corrective lenses
Chalazion,eyelid bump,swelling,tenderness,vision problems if large,Blocked oil gland in eyelid,Warm compresses antibiotics surgical removal
Stye,painful eyelid bump,redness,swelling,tearing,Infected eyelash follicle,Warm compresses antibiotics drainage if needed
Blepharitis,eyelid inflammation,itching,crusting,burning,Inflammation of eyelid margins,Eyelid hygiene antibiotics warm compresses
Dry Eye,eye dryness,burning,itching,light sensitivity,Insufficient tear production or quality,Artificial tears lifestyle changes medications
Allergic Conjunctivitis,itchy eyes,redness,tearing,swelling,Allergic reaction affecting eyes,Antihistamines avoid allergens cool compresses
Viral Conjunctivitis,red eyes,watery discharge,burning,light sensitivity,Viral infection of eye membrane,Supportive care artificial tears avoid spreading
Bacterial Conjunctivitis,red eyes,yellow discharge,crusting,burning,Bacterial infection of eye membrane,Antibiotic drops warm compresses good hygiene
Keratitis,eye pain,light sensitivity,tearing,blurred vision,Inflammation of cornea,Antibiotics antifungals artificial tears
Corneal Abrasion,eye pain,tearing,light sensitivity,foreign body sensation,Scratch on cornea surface,Antibiotic drops pain relief eye protection
Corneal Ulcer,severe eye pain,light sensitivity,discharge,vision loss,Open sore on cornea,Emergency treatment antibiotics hospitalization
Iritis,eye pain,light sensitivity,blurred vision,red eye,Inflammation of colored part of eye,Steroid drops dilating drops treat underlying cause
Scleritis,severe eye pain,light sensitivity,red eye,vision problems,Inflammation of white part of eye,Anti-inflammatory medications immunosuppressants
Retinal Detachment,sudden vision loss,flashing lights,floaters,curtain effect,Separation of retina from underlying tissue,Emergency surgery to reattach retina
Macular Hole,central vision loss,distorted vision,difficulty reading,blind spot,Hole in center of retina,Vitrectomy surgery gas bubble injection
Diabetic Retinopathy,blurred vision,floaters,dark spots,vision loss,Diabetes-related damage to retinal blood vessels,Blood sugar control laser treatment injections
Hypertensive Retinopathy,vision changes,headaches,double vision,vision loss,High blood pressure damage to retinal vessels,Blood pressure control medications lifestyle changes
Retinal Vein Occlusion,sudden vision loss,distorted vision,dark spots,swelling,Blockage of retinal vein,Anti-VEGF injections laser treatment steroids
Retinal Artery Occlusion,sudden painless vision loss,cherry red spot,pale retina,severe visual impairment,Blockage of retinal artery,Emergency treatment hyperbaric oxygen
Vitreous Hemorrhage,sudden vision loss,floaters,red haze,light sensitivity,Bleeding into vitreous cavity,Surgery laser treatment treat underlying cause
Retinitis Pigmentosa,night blindness,tunnel vision,light sensitivity,progressive vision loss,Inherited disorder causing retinal degeneration,Vitamin A low vision aids genetic counseling
Leber Congenital Amaurosis,severe vision loss from birth,nystagmus,light sensitivity,developmental delays,Inherited retinal dystrophy,Gene therapy low vision aids supportive care
Stargardt Disease,central vision loss,difficulty reading,color vision problems,progressive vision loss,Inherited macular dystrophy,Low vision aids lifestyle modifications genetic counseling
Best Disease,central vision problems,metamorphopsia,reading difficulties,variable progression,Inherited macular dystrophy,Monitoring low vision aids lifestyle modifications
Cone-Rod Dystrophy,color vision problems,light sensitivity,central vision loss,progressive symptoms,Inherited retinal degeneration,Tinted lenses low vision aids genetic counseling
Rod-Cone Dystrophy,night blindness,peripheral vision loss,light sensitivity,progressive symptoms,Inherited retinal degeneration affecting rods first,Vitamin A low vision aids mobility training
Usher Syndrome,hearing loss,night blindness,balance problems,progressive vision loss,Inherited disorder affecting hearing and vision,Hearing aids cochlear implants low vision aids
Bardet-Biedl Syndrome,obesity,extra fingers,kidney problems,retinal dystrophy,Genetic syndrome with multiple organ involvement,Multidisciplinary care low vision aids genetic counseling
Alstrom Syndrome,obesity,hearing loss,diabetes,retinal dystrophy,Rare genetic syndrome with multiple system involvement,Multidisciplinary care supportive treatment genetic counseling
